{
  "version": "1.0.0",
  "lastUpdated": "2025-11-11T20:00:00Z",
  "tasks": [
    {
      "id": "P2-PROF-T1",
      "phaseId": "P2",
      "title": "GET /api/users/:id - Retrieve User Profile",
      "status": "complete",
      "priority": "P1",
      "complexity": "medium",
      "startDate": "2025-11-10T10:00:00Z",
      "completionDate": "2025-11-11T11:30:00Z",
      "execution": {
        "totalTokens": 105000,
        "totalDuration": "55 min",
        "approach": "hybrid",
        "subtasks": [
          {
            "id": "P2-PROF-T1.1-repo",
            "approach": "subagent",
            "tokens": 70000,
            "duration": "30 min",
            "tests": {
              "passing": 43,
              "total": 43
            }
          },
          {
            "id": "P2-PROF-T1.2-controller",
            "approach": "direct",
            "tokens": 22000,
            "duration": "15 min",
            "tests": {
              "passing": 15,
              "total": 15
            }
          },
          {
            "id": "P2-PROF-T1.3-route",
            "approach": "direct",
            "tokens": 13000,
            "duration": "10 min",
            "tests": {
              "passing": 11,
              "total": 11
            }
          }
        ]
      },
      "tests": {
        "total": 69,
        "passing": 69,
        "failing": 0,
        "skipped": 0,
        "coverage": 90,
        "distribution": {
          "unit": 20,
          "integration": 35,
          "e2e": 10,
          "edge": 4
        }
      },
      "gitCommit": null,
      "learnings": [
        "Schema discovery Phase 0 critical (avoided 30K token waste)",
        "Direct execution 50% more efficient than subagent for straightforward tasks",
        "Integration-style tests simpler than Jest mocks (avoid mocking complexity)",
        "Test count (69) exceeded budget (25) but quality warranted it",
        "Layered architecture needs 60-80 tests per full CRUD feature (not 25)"
      ],
      "issuesEncountered": [
        {
          "bugId": "BUG-001",
          "summary": "Jest mocking complexity with repository",
          "resolved": true
        },
        {
          "bugId": "BUG-002",
          "summary": "TypeScript type conflicts with Express Request",
          "resolved": true
        }
      ],
      "filesCreated": [
        "src/services/user-service/repositories/user.repository.ts",
        "src/services/user-service/controllers/user.controller.ts",
        "src/routes/user.routes.ts",
        "src/middleware/validation.middleware.ts"
      ],
      "filesModified": [
        "src/app.ts"
      ],
      "notes": "Excellent quality, established new patterns for Phase 2+. Full GET endpoint working end-to-end with field-level access control."
    }
  ],
  "metrics": {
    "totalTasks": 1,
    "avgTokensPerTask": 105000,
    "avgDuration": "55 min",
    "avgCoverage": 90,
    "preferredApproach": "hybrid"
  }
}